{
  "release_id": "local-dev",
  "bundle_version": "0.1.0",
  "created_at": "2026-01-29T20:29:10.211596+00:00",
  "git_sha": "28a4fdb0587619c3c42c4e7f51921c1bcf624e2d",
  "model_name": "local-llama-gguf",
  "base_model": {
    "name": "llama",
    "version": "2-7b"
  },
  "tuning_method": "none",
  "training_config_hash": "d14b48875b83f323c37c5de5d83197202e3880850b245e0d71a3071a74ac52da",
  "dataset_fingerprint": {
    "algo": "sha256",
    "value": "4d2adc899e03441ed5cfb117e982b9f3a2b896218db0faef459fa2f77da4ba01"
  },
  "runtime_compatibility": [
    "llama.cpp"
  ],
  "quantization": {
    "format": "Q4_K_M",
    "bits": 4,
    "group_size": 32
  },
  "parameters": 7000000000,
  "license": "unknown",
  "tags": [
    "local",
    "gguf",
    "llama.cpp"
  ],
  "intended_use": "Local agentic RAG evaluation and release bundle demo.",
  "limitations": "Demo-only model card; not tuned for production use.",
  "eval_report_path": "eval/eval_report.json"
}